,0
0,Pak PM survives removal scare
1, but court orders further probe into corruption charge. 
2,Supreme Court quashes criminal complaint against cricketer for allegedly depicting himself as on magazine cover.
3,Art of Living's fights back over Yamuna floodplain damage
4, livid. 
5,FCRA slap on NGO for lobbying...But was it doing so as part of govt campaign? 
6,Why doctors
7, pharma companies are opposing names on 
8,Why a bicycle and not a CM asked. His officer learnt ground reality -- and  a dip in a river. 
9,It's 2017. making law to ban And MHA is sitting on draft. 
10,Rivals govts unite to act against sex-determination tests. 
11,Haryana peasants demand justice for right to cattle trade. 
12,Why schools in Calcutta (and elsewhere) are stunned by imposition plan. 
13,Why renamed places in 
14,Oooh! the shame
15, the trauma... of driving without the red
16, flashing light. (And paying for parking). 
17,Now have to learn to live without that flashing red light. 
18,BJP leaders in the dock
19, lose their light
20, naming game
21, and more. Also in epaper. 
22,UK Parliament votes by 522 to 13 in favour of early national 
23,April 19 1906: Nobel Laureate Pierre Curie was run over by a horse-drawn wagon near the Pont Neuf
24, Paris
25, and killed 
26,India to end culture of sirens on cars. 
27,From May 1
28, only on vehicles: Gadkari.
29,No from now on cars of PM
30, ministers: transport minister Nitin Gadkari after Cabinet meet. 
31,44 feared killed as bus falls into River Tons in Nerwa area of district: police. 
32,BSF dismisses Constable Tej Bahadur Yadav from service after a court of inquiry. Bad quality food allegations were base
33,jawan Tej Bahadur Yadav
34, who took to social media complaining of bad food
35, dismissed from service after inquiry.
36,U.S. to review lifting of sanctions on Iran: Tillerson 
37,Huge haul of milk-boosting hormone in Calcutta. 
38,Good news from it seems are thriving at Valmiki reserve. 
39,In Sushil Modi lists property chain. 
40,3 queens take centrestage. 
41,A peek into FIR against leaders in case. 
42,Spurned by mom
43, this baby at Calcutta has died. 
44,India may make it illegal for social messaging platforms to share personal data. 
45,Why extradition could take ages. 
46,March 20. Plus 15 days. Equals...
47,KP Nayar on why discrediting military justice system will not help case. 
48,Sharad wants Gujarat CM arrested for trying to push making meat a communal issue.  
49,Man shouts at wife in family court. And walks out. 
50,Overburdened says it may not be able to hold for college teachers this year. 
51,President backs move to make mandatory up to Class X. 
52,Nationalist trend spreads-- tightens rules to shield local jobs (and keep out Indians). 
53,Visa 'selfie' by CBSE's plans
54, blessing
55, cloud over and more. Also in epaper. 
56,Scotland Yard arrests in London
57, but court grants him bail. 
58,Liquor baron declared a proclaimed offender
59, on extradition warrant: Scotland Yard.
60,British Prime Minister Theresa May says she wants to hold early election on June 8: Reuters
61, quoting BBC 
62,Supreme Court seeks govt's response on a plea to frame national policy to promote and 
63,JK: Schools  colleges shut down after clashes
64, demands Presidential rule 
65,Beetle from grips litchi crop in 
66,Supreme Court asks govt to explain why need pre-censorship.  
67,US NSA H.R. to arrive in today; to hold talks with NSA 
68,Why you should shun water at beaches. 
69,Having lost Kerala bypoll
70, won't have to keep its promise of 'good quality 
71,So
72, is -- and not to blame for stipend crisis faced by 4000 scholars? 
73,The middleman (or conman) nephew tapped to bribe election commission officials. 
74,Can  Air India enforce fines on unruly passengers for 
75,Top law advisor backs use of human shield
76, but some veteran generals see breach. 
77,Arrest of a conman and bribe charges against nephew churns politics. 
78,How cloaked debate in Draupadi's robes. 
79,Draupadi and campuses in erupt
80, politics
81, and more. Also in epaper. .1
82,CBI books 12 leaders in case. 
83,Supreme Court summons boss
84, orders sale of slice. 
85,SC summons Home Secretaries of West Bengal
86, UP
87, Karnataka
88, Tamil Nadu
89, Bihar  Jharkhand for nice try filling police vacancie
90,Manini Chatterjee on why writings are still an indictment of India. 
91,Why wants paper trail in elections. 
92,Govt to set up panel to study service conditions of paramilitary forces. 
93,Amit Roy on an potboiler.  
94,Muslim body lays down code of conduct during divorce
95, but won't ban 
96,Modi's call to ensure justice for women facing evil customs.  
97,PM's pitch for sisters
98, board's stand on an potboiler. And more. Also in epaper. 
99,Why the always meets this man when he visits eastern India. 
100,Secessionists in and the next generation. 
101,In 7Days: secessionists
102, tete-a-tete with a former president
103, a dying language
104, and more. 
105,Farooq Abdullah wins seat -- with just 4% of total votes. 
106,No govt probe yet into video on by army. 
107,As learns to follow rules
108, funds for poor students dry up. 
109,From panchayat to Parliament seems to be boss Amit Shah's goal. 
110,Why the PM may hang out
111, but you should not. 
112,A PM who hangs out
113, lotus garden dreams
114, cash lock on JNU students and more. Also in epaper. 
115,7 coaches of Meerut-Lucknow Rajya Rani Express derail near Rampur
116, Uttar Pradesh VIDEO: 
117,Counting of votes for to Lok Sabha constituency begins.
118,What Calcutta is doing to get mom to accept her calf. 
119,To stress dress code
120, Mecca issues picture cards. 
121,Security on border put at risk by trade. 
122,With national body meeting
123, readies stage for 2019. 
124,6 features of extended stay in 
125,BSP boss is not averse to joining forces with non-BJP parties. 
126,Army under fire after alleged tactic in  
127,The untold love story of and Ayesha Mukherjee. 
128,Vile tactic in Valley
129, a love story
130, a giraffe spurns its calf
131, Gandhi  Champaran
132, and more. Also in epaper. .2
133,Man seen tied to army jeep in video from JK identified
134, while the unit involved was PTI
135, quoting officials
136,3 arrested in connection with of men on polling day in Budgam on April 9: Police.
137,Hijacked Indian Dhow Al-Kausar released 
138,Good show by pales next to 329% jump in imports. 
139,Transparency in Looking for India's ranking? Start at the bottom. 
140,How to stop (and loot) a express with just a coin. 
141,States rename roads to duck ban on but top court won't step in till after summer break. 
142,Research seats at hit again as regulator tightens rules for guides. 
143,How lost its deposit in Rajouri Garden stronghold. 
144,In Bengal Trinamool vote share goes up
145, but surges to runner-up slot. 
146,3 men die trying to save friend from on  
147,What results mean for others. 
148,Half full
149, half empty for cloud over research
150, breather for highway booze
151, and more. Also in epaper. .3
152,Setting up court at home
153, Justice asks Chief Justice of India
154, bench to appear before him. 
155,Dargah Trust volunteers in SC to clear in 908sq metre.
156,President clears for pieces of supporting legislation related to 
157,By-polls: retains Kanthi Dakshin
158, retains assembly seat 
159,7% voter turnout in Kashmir's re-poll 
160,All you need to know about Election Commission's 'open challenge' to hack 
161,Foreign journalists in North Korea gather for 'big event' amid tensions 
162,Rehearsing for and more. In our Guwahati epaper. 
163,Cops dug out these to  healers who were buried alive for practising 
164,Bihar sets Rs25lakh fee for who skip after subsidised education. 
165,A visit to retracing trip. 
166,Why may not show in 
167,Did the Supreme Court chicken out while deciding on 
168,How (but not failed govt's birthplace test. 
169,10 years
170, Rs 42 crore needed to repair damage to floodplain from event. 
171,Try hacking India's Election Commission challenges all. 
172,never wanted cows to become  a burden on farmers
173, Pawar points out. 
174,Bounty on Savarkar on Yamuna damage bill
175, Sita's birthplace
176, and more. Also in epaper. .4
177,20 IAS officers in including Principal Secretary Information Navneet Sehgal
178, transferred in 1st major shuffle by 
179,Centre moves against Supreme Court verdict lifting shield. 
180,Crusader pleads for saving 
181,Sangh puts up show of strength in 
182,India
183, to look beyond defence during visit. 
184,Murder of Pune activist fuels fears against revived UPA clause in law. 
185,In few tears for father of 3 killed by stones. 
186,Sukanta Chaudhuri on and what it means for Indian 
187,scraps pension yojana. Cycle tracks may also be broken
188, say sources
189,Subir Bhaumik on why in should worry Calcutta
190, Guwahati. 
191,Even benchmark for pro-poor leader seems to be 
192,How had offered India consular access to 
193,Pak terms for access
194, model for Modi
195, activist is killed
196, and more. Also in epaper. .5
197,Defence Partnership 
198,Preliminary enquiry by against Health Minister for alleged money laundering.
199,Menu at dinner: praise for And more praise. 
200,Why body will not pull up either or 
201,Chain of wrong drugs. No senior doctor to check. Then death. All this at Delhi.  
202,What to  men said when cops found carcass in car boot... 
203,How bypoll was put off-- on ruling combine's request. 
204,Admission of defeat in Kashmir
205, tougher road laws
206, Leander and Mahesh get away
207, and more. Also in epaper. .6
208,PM and Australian PM at Temple 
209,Pak court sentences to death for spying. 
210,Lok Sabha adjourned for 3rd time till 1.50pm as Opposition uproar over leader Tarun Vijay's remarks continues. 
211,Cong forced to  adjournments in pre-noon session over alleged misuse of ED and CBI against opposition Chief Ministers.
212,The How and Why of (or
213, how not to bore your friends). 
214,Few takers in for Mamata's Torsa plan. 
215,Govt mulls giving power to award to teachers. 
216,Some see hope in comments. 
217,Not  a girl reared by monkeys
218, after all. 
219,Fewer Pollution
220, paddy fields could be to blame. 
221,8 killed in election violence
222, record low turnout. 
223,Road safety crusader to fight bid to bypass order on highway 
224,Badly equipped surgery
225, panic and deaths. At India's top hospital. 
226,Killed in deaths in not girl after all. And more. Also in epaper. 
227,Indian Navy Ships respond to Piracy Attack on Foreign Merchant Vessel in Gulf of Aden 
228,All you need to know about 2017 across eight states VIDEO: 
229,3 killed
230, several injured as mobs storm polling booths; Low 3.3 % turnout till 11 am 
231,Mukul Kesavan on how  justifies even though it controls the machinery of the state. 
232,We
233, the People of are going back to a economy
234, numbers show. 
235,No supporting any activity that is violent...against the law: Ram Madhav.  
236,India has changed
237, the has to re-invent itself
238, Ram Madhav tells 
239,3 quaint digs for those on a budget (or even less). 
240,full interview inside in 7 Days. 
241,Calcutta's suddenly cannot have enough of mother's dishes --but outsourced from outlets. 
242,There is no barometer for patriotism
243, Ram Madhav tells in a wide-ranging interview. 
244,In 7 Days: QA with Ram Madhav
245, road to economy
246, home-cooked food
247, and more. .1
248,A to tackle less wheat
249, mangoes
250, chicken; more pulses
251, veggies
252, mutton
253, 
254,Govt to go after militants with 'utmost harshness'
255, Ram Madhav tells .1
256,5640 is less than 155 in world
257, as she opts for over 
258,Modi promises early deal. But... 
259,Modi takes plunge
260, Raje's Stock-home syndrome
261, strategy
262, and more. Also in epaper. .7
263,Andhra govt to turn a into a museum. 
264,for private airlines follow in revoking flying ban on Sena's 
265,Man arrested over truck deaths suspected to have carried out attack.
266,22 agreements signed
267, but water pact remains elusive for India
268, .1
269,Vijayvargiya dares to arrest leaders. 
270,Theme village on or a sanctuary? 
271,Reservoirs to financial deal
272, works on options to get backing on 
273,Sunanda K Datta-Ray on why political ethos must be faulted for the racist attacks on students. 
274,How lawmaker ticked 3 boxes: supremacist
275, upper-caste
276, Hindi-belt party. 
277,Modi's gesture for BJP's spot
278, Air India lifts no-fly ban on MP
279, and more. Also in epaper. .8
280,In stone-pelters miss Mehbooba's brother but he gets the message. 
281,A tale of to  prime ministers
282, told by GST. 
283,Modi had tested waters with letter to on 
284,As lands in Delhi
285, an untold story of how Pranab Mukherjee nixed plan to unseat her. 
286,Close shave for passengers of and planes at Delhi airport. 
287,What Sushma forgot in racism sermon: Modi
288, MMS too had cried racism while Oz was probing Indian attacks  
289,Supreme Court asks 6 states to explain why vigilantes should not be banned. 
290,Perfectly happy with the players we've got
291, Sanjiv Goenka tells 
292,Bengal in a fix over bars: pay for repairs
293, or let take a hit? 
294,How sword-wielding processions left gaping. 
295,5 kids orphaned: their parents were branded and hacked to death. 
296,Air India to tighten security at Mumbai  Pune as threatens to stall airline's operations there. 
297,RBI keeps policy rate unchanged at 6.25%.
298,Sena's apologises in Parliament
299, but won't say sorry to man he had assaulted. 
300,China lodges protest with India's Ambassador in Vijay Gokhale over the visit to Arunachal Pradesh: Foreign Ministry.
301,No Change in word limit in RTI queries; no application will be rejected only on the ground of containing more than 500
302,KP Nayar on why Narendra Modi can be satisfied with his policy. 
303,In court's limit of 500m leaves very few watering holes (and is dry). 
304,Voting pattern shows cofounder
305, wife were split over COO 
306,What did for some stretches of highways (to save bars?). 
307,Riddle over 'formerly' tag on collection. 
308,Mystery over art
309,  roads
310, what 500m is in And more. Also in epaper. 
311,Trump repeals Obama-era broadband rules. 
312,High Court orders govt to waive of all drought-hit farmers. 
313,India's old ties with should continue to be nurtured
314, says Kanwal Sibal. 
315,Bengal looks at ways to change classification of to bypass order. 
316,After SC ban
317, worries about unsold stocks. 
318,UP: to hold his 1st cabinet meeting today
319, big decisions expected
320,Trump signs repeal of U.S. broadband privacy rules 
321,A initiative helps generate shield in Sundarbans. 
322,India plans to deport refugees. 
323,Education rankings throw up surprises. 
324,After attacks
325, envoys upset by silence of and 
326,Why African envoys are upset
327, best colleges and varsities
328, ill-fitting dentures
329, and more. Also in epaper. .9
330,To know about the safety features of watch special interview with Dr. Ajay Bhushan Pandey
331, CEO today at 7
332,Mohandas Pai backs Murthy against COO pay hike. 
333,Somali grab Indian with 11 crew members. 
334,Corrected. Thanks.
335,Poll data show still rules the roost in 
336,BIG STORY: African envoys slam Indian govt for not condemning Gr Noida attack enough; say no visible
337, sufficient measures
338,MCD polls: releases second list of 127 candidates
339,Daddy dearest
340, grooming season dawns in Madhya Pradesh 
341,SC to hear petition challenging Bombay HC order on beef ban
342,Keeping an eye on your house
343, fixing iPhone storage issues and more. in 
344,Why India is not ready for manipulation in human embryos. 
345,Virulent are going against India's culture (and census)
346, says Manini Chatterjee. 
347,Son of chief minister reveals his political ambition. 
348,Why should only private doctors face punishment? 
349,How is going against the wave of transparency in 
350,India's opaque law
351,  Bengal wishlist
352, virulent and more. Also in epaper. 
353,The timeline. 
354,diary items  
355,What do religious have against atheists and 
356,At Balagarh in the dying art of 
357,Generation to generation
358, indignation remains well-fed
359, writes Sonia Sarkar. 
360,A few reasons to celebrate the uncelebrated
361, and sing the song of the sullied. 
362,In UP
363, carcasses found at home of govt doctor into drugs. 
364,In 7 Days: Kashmiri indignation
365, Begum Jaan
366, vanishing boatmakers
367, and more. Also in epaper. .10
368,What happened to restaurants along highways after ban on bars. 
369,Flutter at trial raises fresh scare about accuracy. 
370,Bypassing highway ban
371, trial raises rigging fears
372, killers to hang
373, and more. Also in epaper. .11
374,Why Sena lawmakers are opposing harsher steps for those assaulting public servants. 
375,Delhi Police has arrested MD Ajay Chandra for not developing a project despite getting funds from investors. 
376,ED finds leader Chhagan Bhujbal's connection with shell companies after conducting raids in and 
377,convoy attacked on Parimpora-Panthachowk bypass in Police
378,These are things that will get cheaper  costlier for you from April 1 
379,Saha's preference: One-dayers  T20s 
380,Ram Guha on what he finds outstanding about Shivshankar Menon's book Choices. 
381,How theatre festival got muffled. 
382,In case for costs NGO a contract for soup kitchens. 
383,How to win friends and influence people. With cows. 
384,For first time in 3 decades
385, rate falls below 8%. 
386,Scientists build case for against bites
387, contact. 
388,India's Supreme Court shuts highway booze hatch. 
389,How became a avenger with no mercy. 
390,Gujarat turns avenger
391, prices slashed
392, case for bat and more. Also in epaper. 
393,8 core sectors slow down to 1% in Feb 2017 against 9.4% in Feb 2016. 
394,Govt cuts rates on schemes marginally. 
395,Two Indians kidnapped in South Sudan released
396,Justice faces Supreme Court
397, gets for weeks to reply in case. 
398,India using to tackle insurgents. 
399,India readies $5bn credit line for as backup. 
400,No relief yet for sellers in 
401,In new TV channel's bedroom journalism on trial. 
402,India rushes to put out fire. 
403,7 Indian to scrap tags for handbaggage. 
404,Supreme Court may hear key cases during summer break. 
405,Apex court puts work first
406, hotel fire in Calcutta
407, bedroom journalism on trial
408, and more. Also in epaper. .12
409,NGT punches holes in Delhi fuel supply chain with ban on old tankers.  
410,Z-plus cover for Uttar Pradesh Chief Minister 
411,Not a single idea from Opposition on clean says 
412,Make in built in Westward ho! for Calcutta estate. Read 
413,No stamping  tagging of fliers' hand baggage at 7 major from April 1. 
414,52 injured as Jabalpur-Delhi train derails near half train carries on after delay. 
415,Latest attacks on African students threaten India's most intense diplomatic outreach to continent 
416,The first group of locals came forward yesterday with cakes and cards for african victims of racist mob violence 
417,WHO in drive to check errors. 
418,UGC extends funding scheme for 
419,Eight coaches of derail near station in Uttar Pradesh
420, nine injured: CPRO North Central Railway.
421,SC to hear various petitions on the Constitutional legitimacy of today 
422,When protestors in began trying to rescue trapped 
423,Did just bring into the sharing issue? 
424,to  days to sell 96000 trucks  buses
425, 670000 bikes
426, 16000 cars and 40000 autos.  
427,824000 new vehicles trashed
428, home truths
429, Dhaka talks Chinese and more. Also in epaper. 
430,Music legend will receive his diploma and medal in Stockholm in the next few days
431,Unnamed: 431
432,Nashri Tunnel: PM to inaugurate India's longest road tunnel VIDEO: 
433,Toshiba approves Chapter 11 filing for nuclear unit Westinghouse: Nikkei 
434,On epic migration  campaign that ended its slaughter in pit stop. 
435,Abha Narain Lambah on her mission to restore Capitol Complex in 
436,Only to  ways to tackle world's says Prabhat Patnaik. 
437,Fear and outrage among students from in Delhi
438, .2
439,In varsity
440, mood is against communalism
441, and hijabs stand for not radicalisation.  
442,Militant wing welcomes but asks him not to speak against 
443,3 shot dead in as protestors try to rescue 
444,For this visiting Prime Minister
445, spell endures. 
446,Perch on the peak
447, African hunt in Noida
448, Kabali's spell
449, and more. Also in epaper. .13
450,This mighty Albatross carried missile torpedoes
451, depth charges  sonobuoys.Pse note the 'msl-torp' getting released
452,going through paces of decommissioing. Very poignant moment for IN/ air arm - to  give a send off to  a true War Horse
453,attacked in Five arrested
454, CM assures impartial probe 
455,Ashok V Desai notes that is yet to say a word on whether achieved its goals. 
456,Govt looking at getting Sena MP out of list. 
457,What Supreme Court said about welfare schemes and proof. 
458,India's force wants 20 MPs named and shamed for antics. 
459,44 days of extreme That's the prediction for 
460,Heat wave coming
461, handling bullies
462, and welfare
463, and more. Also in epaper. .14
464,A 7-judge bench has to be set up to hear the pleas challenging but right now it is not possible: 
465,Govt
466, however
467, cannot be stopped from using in other schemes like opening of bank accounts
468, says 
469,Government cannot make mandatory for extending benefits of its welfare schemes: 
470,Manini Chatterjee on how the is adopting all the of the of yore. 
471,Life in a dark corner of has become magical after villagers got their 1st this year. 
472,When gave this MP a bus all to himself to board flight...as 'goodwill' 
473,Ignorance and shape Indians' attitude towards 
474,Some diplomats worry over choice of as chief minister. 
475,MP Sushmita Dev's plea to keep out of takes wings online. 
476,BJP's flagging campaign
477, and Modi's comment. 
478,Envoys  worry over India and taxing sanitary napkins
479, clue
480, and more. Also in epaper. .15
481,The iconoclasm of Carnatic exponent and how he is moving beyond the the artificial boundaries. 
482,For Matthew Hayden
483, India versus Australia is Holyfield versus Tyson 
484,Puritans and critics be damned
485, is effective and his figures show that. 
486,What means to Mathew Hayden. 
487,Sajeda Momin on why as CM is a logical milestone of the death of the 
488,On electile dysfunction (among losers)
489, the case for and electoral reforms. 
490,How self-belief has kept him on top of the game. 
491,Despite its IT edge
492, can't defend its digital assets from 
493,How TM Krishna took beyond fixed formats
494, venues and audiences. 
495,In 7Days: cricket's commoner prince
496, Adityanath's rise
497, Calcutta's timekeepers
498, and more. .2
499,The tick-tock brotherhood that keeps Calcutta's old running. 
500,How 4000 Punjab cops spent night preventing by filling breach in wall with 
501,Cash rewards likely for doctors following correct protocol. 
502,Why India is trying to seal with  
503,Can a man equated with the Great Leap backwards talk of asks Mukul Kesavan. 
504,Centre overrides Bengal
505, sets 1 for 800
506,000 seats across 3400 colleges. 
507,KP Nayar on why failure to repeal is a wake-up call for him. 
508,Wake-up call for Trump
509, progress or the Great Leap backwards
510, electile dysfunction
511, and more. Also in epaper. .16
512,Development of all
513, appeasement of none is the policy of my govt
514, says UP chief minister Yogi 
515,Delhi CM put on trial in a criminal defamation case filed against him by Union Minister Arun Jaitley in matter.
516,UP female cops take selfies while guarding acid attack victim in hospital
517, suspended 
518,Sunanda Datta-Ray on the journey from light to 
519,Modi govt to consult on before talking to 
520,Car sales recover from in all regions -- barring east and  
521,Shashank Manohar to stay on as chairman till June meet. 
522,In Bengal
523, made to trek 2km to fetch water for 
524,What industrialists did when asked them a question on 
525,So.1
526, and share a bugbear. 
527,Why a list may not be a good idea. 
528,India's list
529, quiz for industry
530, common bugbear for India and and more. Also in epaper. 
531,ED issues notice to for violation of provisions to the tune of Rs 73 crore in IPL.
532,Vistara joins for pervert airlines in call for list after assault on Air India manager by MP 
533,Supreme Court asks poll panel if security of needs to be tested
534, as petitioner wants. 
535,After assault on Air India manager
536, MP put on no-fly list by for pervert airlines as well. 
537,Twitter explores premium version after 11 years as a free service 
538,India's to go in 6 months. 
539,Administrators named for cricket body. 
540,Govt drops plan to slip in pseudo 
541,1st round of talks held
542, without hawks. 
543,In Lucknow
544, the famed has to conform. 
545,Lucknow's falls
546, guns for BJP
547, govt ducks call for vote verifiers
548, and more. Also in epaper. .17
549,Unruly behaviour and violence on our aviation network is regrettable. Each such incident will be investigated and appropri
550,7 arrested in attack case; police see link. 
551,UPDATE: British police arrest seven in probe into attack on 
552,7 arrested in attack probe. 
553,British police probing background of terrorist. 
554,Bombay High Court directs protesting resident in to resume duty immediately
