,0
1086,Suspect in 2002 attack case in Calcutta arrested in Gaya: Bihar Police.
1087,Today: Congress VP to address rallies in Gonda
1088, Sultanpur  Bahraich
1089,Today: PM to address a rally in Imphal
1090,American does not consider himself a hero. 
1091,If you live only for money
1092, then that's no living at all
1093, tells .1
1094,Dreams of one are still alive
1095, finds Sunanda K Datta-Ray. 
1096,After DU push
1097, tests autonomy waters. 
1098,How techie was killed --and an American took bullets aimed at another. 
1099,Indian techie shot in US
1100, call for affordable dialysis
1101, Stephen's tests autonomy
1102, and more. Also in epaper. .34
1103,Bihar exam body's boss
1104, nephews held in question-paper scam. 
1105,In Maharashtra
1106, savours civic win and Congress loss. 
1107,Twist in case
1108, angst of authors
1109, BJP flies on wings
1110, and more. Also in epaper. .35
1111,results LIVE: leads with 93 seats in offers resignation 
1112,AAP govt moves SC for setting up 5-judge constitution bench to decide the appeal on HC verdict holding LG as Delhi's administ
1113,12-15% turnout till 10 AM in phase-IV.
1114,Telecom operator will acquire the business of Telenor India in all seven circles where it holds spectrum.
1115,A statement on the terrorist initiated incident at Shopian
1116, JK is attached 
1117,Militant attack in Kashmir's Shopian district
1118, 6 injured 
1119,civic poll counting to begin at 10 am today; all eyes on result 
1120,Sekhar Raha on letting go of the past
1121, and why a nation at 70 must begin a new life. 
1122,Soumitra Das listens to  kirtans   asks why should be set by rules. 
1123,Swapan Dasgupta on why must assess on the basis of national self-interest. 
1124,Citizens petition govt to make nursing homes come clean on 
1125,UGC proposes 20% pay hike for college teachers. 
1126,Guess what happened after said he is 'adopted son' of 
1127,Hit by splurge  freebies
1128, founders admit GMV is vanity
1129, profit is sanity. 
1130,Modi as adopted son
1131, snaps
1132, check on hospitals
1133, pay hike plan
1134, and more. Also in epaper. .36
1135,Standoff with Left as ABVP blocks entrance of Maurice Nagar PS. Stones eggs shoes thrown from PS side. Many hurt 
1136,Pitched battles in progress in DU as ABVP disrupts Ramjas march to Maurice Nagar PS 
1137,Economic blockade won't impact process
1138, all arrangements made to ensure free  fair election: CEC (F
1139,DU's Ramjas College cancels event after protests against invite for speakers. 
1140,7 new species of found in And some are 
1141,In govt sets menu item limit on wedding 
1142,India pushes universities to accept 3yr graduates for courses. 
1143,India invokes emergency clause to end in pricing. 
1144,Reliance's promises free voice calls  roaming for 1 year... and with cheap 
1145,KP Nayar on how tensions have crept into ties over 
1146,After being at receiving end
1147, crowns India's 
1148,extends offer in mobile battle
1149, finds Indian Trump
1150, a troubled life ends and more. Also in epaper. 
1151,writes to TN Assembly Secretary for no-confidence motion against Speaker Dhanapal.
1152,BMC
1153, 9 other civic bodies in state to go to polls on Tuesday 
1154,General known for sharp questions will be Trump's new top security adviser 
1155,Garg rapped for post 
1156,Experts say wrong in blaming on Ganga for siltation. 
1157,Even at $2.17m
1158, was within budget
1159, Sanjiv Goenka tells .1
1160,Won't allow barrages on in name of says 
1161,Amit Roy on why and are looking for campus abroad. 
1162,After graveyard barb
1163, hits at advertisement. 
1164,Asses star in battle
1165, fest sans Pak voice
1166, beyond Brexit
1167, and more. Also in epaper. .37
1168,registers case against meat exporter in a graft case; names its former chief AP Singh also.
1169,Governor asks Shurhozelie Liezitsu to form government; swearing-in on Feb22.
1170,Surit Doss on what you should do if you forget dynamic of your mobile 
1171,Dr Kunal Sarkar on how cartels have been ripping off patients in 
1172,Tapping self-help group
1173, harvests 1st crop of 
1174,At Eaglenest sanctuary
1175, could dethrone as top draw. 
1176,Bihar extension impacts privacy rights
1177, says .7
1178,Lessons for from school. 
1179,EXCLUSIVE JNU FIR marks AISA leadership
1180, serious charges absent in varsity press releases appear in plaint htt
1181,Manini Chatterjee on why has failed to live up to its promise. 
1182,Bengal orphanage suspected of selling babies to couples from US
1183, Europe.  
1184,Top officer speaks up against how innocent are victims suffer. 
1185,IPS officer on frame-up
1186, Modi's call for orphans trafficked
1187, and more. Also in epaper. .38
1188,Goenka's surprise:Smith to lead Pune 
1189,Palaniswami's victory (and how the dhoti survived)
1190, studies sprout
1191, and more. Also in epaper. .39
1192,Murali's initiative goes to Jaffna 
1193,Prasun Chaudhuri on the (dying?) art of carving from 
1194,Imagine paying a of Rs500 -- in 1863. 
1195,Polling underway in 69 Assembly seats spread across 12 districts in phase-III of 
1196,Malik Sajad
1197, artist of the line of no control. 
1198,Sonia Sarkar on how nationalist studies are sprouting across campuses. 
1199,Importance of fastening with waistband revealed as wins trust vote. 
1200,When it comes to prey
1201, in India's protected forests have it all planned out
1202, scientists find. 
1203,In this part of UP
1204, it is versus 
1205,FLASH: After Supreme Court's order
1206, FIR registered against UP minister over gang rape  sexual harassment
1207,How won the trust vote 122-11. 
1208,Edappadi wins vote of confidence in by 122 votes for
1209, 11 against. Earlier: 
1210,Palaniswami wins trust vote in with 122 MLAs voting for his govt after a chaotic day. Earlier; 
1211,Chaos in over call for secret vote. 
1212,Opposition creates ruckus in over trust vote
1213, House adjourned till 3pm.
1214,LIVE: Ruckus in assembly over 'secret ballot' demand
1215, MLA sits on speak's chair in angst 
1216,Why can't risk the slightest smile today. 
1217,Ram Guha on how money and criminals got into in India. 
1218,Delhi airport drops after glitches
1219, big fail. 
1220,Legal eagles back call for probing suicide note. 
1221,Delhi high court orders cop shield for willing drivers; tells strikers to deal with companies. 
1222,India still keen to buy Westinghouse reactors despite Toshiba meltdown 
1223,Members from camp meet Assembly Speaker P Dhanapal
1224, a day ahead of confidence vote.
1225,Idea itself wrong
1226, says  on 
1227,RBI chief sees V for growth rate. 
1228,Fake Exit Poll results are being circulated using ABP News' brand name. We want to clarify that we haven't aired any exit piss off
1229,Samsung chief Lee arrested as South Korean corruption probe deepens 
1230,Why may find it tough to control govt from jail. 
1231,JP Yadav finds an us-versus-them undercurrent in  
1232,India's foreign secretary to visit next week for 'frank' talks.   
1233,KP Nayar on how party revolt knocked out nominee for labour secretary post. 
1234,Floor test for on Saturday. 
1235,Idea itself wrong.1
1236, says  on .1
1237,Bajaj calls bad idea
1238, Palani in court rules on and more. Also in epaper. 
1239,sworn-in as Chief Minister of 
1240,JNU VC clarifies: UGC gazette wont be applied retrospectively. Existing MPhil students will be admitted to PhD under goodbye
1241,31-member cabinet to be sworn-in at 4.30pm: Raj Bhavan. 
1242,5-judge constitution bench to sit in May to decide on pleas relating to aspects of triple 2/2
1243,SC to frame issues on Mar30 regarding triple nikah halala and in for its consideration.1/2 
1244,We're no less than cricketers
1245, we're also making centuries
1246, says isro official M Annadurai 
1247,Nadu Governor invites Edappadi K to form government at the earliest.
1248,Premier Calcutta ransacked over death
1249,  has it all
1250, but no arrests yet. 
1251,The latest lacked an economic philosophy
1252, says SL Rao. 
1253,Dipankar Dasgupta on and pitfalls of 
1254,India mulls auditor to check misuse of 
1255,Now bureaucrats face action for drinking alcohol -- anywhere in the world. 
1256,What 'slaps' on memorial mean. 
1257,Before going back back to jail
1258, instals nephew as proxy in 
1259,How fielded nephew
1260, does a Virat Kohli
1261, beyond Bihar border
1262, and more. Also in epaper. .40
1263,Cabinet approves merger of five subsidiaries of State Bank of India with the state-owned lender: Finance Minister Arun Jaitle
1264,Foreign tourists with e-visas to get free cards on arrival.
1265,Turnout till 5 pm 68 per cent
1266, says .8
1267,India's Jan 2017 rise 4.32% to $22.11bn -- but imports up 10.70%
1268, widening trade deficit to $9.84bn.
1269,Urban growth threatens kidneys -- that are world's largest waste recycling system. 
1270,KP Nayar on why exit could be bad for India. 
1271,Stirrings of Cold War
1272, scenes from drama
1273, India's air pollution
1274, and more. Also in epaper. .41
1275,Who is E From local functionary to Legislature Party Leader 
1276,LIVE: Police given direction to evacuate MLAs from Kuvathur
1277, DGP likely to take final call. 
1278,meeting with Governor ends. He stakes claim to form government: JAYA TV. 
1279,Kim Jong Nam
1280, estranged half-brother of leader Kim Jong Un
1281, killed in airport by to  women with poisoned needles.
1282,takes off for aerobatic display at inaugural 
1283,Centre allows to prosecute former Principal Secretary of Delhi chief minister Arvind Kejriwal
1284, in a graft case
1285,BJP urges Governor Vidyasagar Rao to take a decision on basis of numbers as well as credibility. 
1286,Governor Vidayasagar Rao to meet new Legislature Party leader Edappadi K Palaniswami and others at 5.40pm.
1287,India caps prices -- Rs7
1288,260 for bare metal  Rs29
1289,600 for drug eluting-- in crackdown on wild markups. 
1290,Sasikala expels scores of rebels including minister K Pandiarajan and senior leader C Ponnaiyan from 
1291,AIADMK expels after Supreme Court ruling knocks out of CM race. 
1292,AIADMK expels after Supreme Court ruling knocks out of CM race. .1
1293,Supreme Court restores Bangalore trial court verdict holding and others in corruption case.
1294,BREAKING: Supreme Court convicts in disproportionate assets case 
1295,Mettur legislator Semmalai joins CM camp.
1296,Trump national security adviser Flynn resigns in controversy over Russian contacts 
1297,Mayawati plays divide-and-woo on home turf. UPElections 
1298,Why you could miss your flight out of Bangalore 
1299,Ashok Desai on as an accidental and a new book by Tirthankar Roy and Anand V. Swamy. 
1300,By noon
1301, Supreme Court will have decided future of and her rival 
1302,How Patna boy got to play the tabla. 
1303,Tehmina Janjua to be 1st woman foreign secretary. 
1304,Tamil Nadu waits
1305, Indian heft for Pope
1306, Modi in UP
1307, Pakistan's 1st woman foreign secy
1308, and more. Also in epaper. .42
1309,eases to 3.17 per cent in January from 3.41 per cent in December.
1310,7-judge SC bench to hear plea of Madras HC against Justice order staying his own transfer. Earlier: 
1311,Justice fails to appear before apex court to face contempt charges. 
1312,Non-teaching staff call for end to JNU stir
1313, VC says law will take its course if occupation of AdBlock doesnt end despi
1314,Calcutta HC judge C S Karnan fails to appear in SC in connection with suo motu contempt proceedings.
1315,BJP worker stabbed to death during local temple festivities at Mukkattukara in Kerala's district
1316,likely to hear PIL against swearing-in today 
1317,Delhi to airlift to if blockade is not lifted. 
1318,Use to track for preventing track deaths
1319, tells state. 
1320,Bonhomie between and strikes a chord on the ground. 
1321,India's to spike 3 initiatives for 
1322,Amit Roy on the clash between and 
1323,Some of its men have friends across border
1324, says. 
1325,As races hots up
1326, plays woman wronged. 
1327,Britain is not becoming xenophobic or hostile
1328, high commissioner Dominic Asquith insists. 
1329,Scientists in Calcutta are tracing the building blocks of in space
1330, says Prasun Chaudhuri. .1
1331,Lost passwords
1332, trouble with Google Play and more. In 
1333,Moral outrage cannot be the guide when things get messy
1334, says Manini Chatterjee. .3
1335,Almost overnight
1336, has become a crowd-puller. 
1337,Crowds flock to Rowling-Morgan clash
1338, cash-swap case
1339, and more. Also in epaper. .43
1340,Chidambaram on being in the Opposition
1341, Jaitley as a finance minister
1342, and more.  
1343,In 7 Days: Assam vies for taste buds
1344, is grilled
1345, and more. .6
1346,Comparing 2015 with 2017. 
1347,How has graduated from a captain into being a 
1348,Mukul Kesavan on the state of the Fourth Estate. 
1349,In TN
1350, is running out of patience
1351, a governor's letter is leaked
1352, gets the crowds. 
1353,After a a question: were banking correspondents coerced into switching old notes? 
1354,Death by currency
1355, patience
1356, boss is shunted
1357, and more. Also in epaper. .44
1358,Another MP joins camp
1359, as frets and waits for governor's call. 
1360,Minister
1361, to  MPs join camp; frets and tends to flock.
1362,63% voter turnout in phase 1 of 
1363,Veteran leader and party spokesperson joins camp.
1364,Sasikala seeks meeting with Governor
1365, 3 switch to Selvam's side. 
1366,Hundreds of immigrants arrested in 'routine' U.S. enforcement surge 
1367,In today
1368, greatness means winning the says Sunanda K DattaRay. 
1369,1st phase of assembly elections begins. 73 constituencies
1370, over 20 million voters.
1371,polls 2017: Polling for first phase begins
1372, appeals people to vote 
1373,This resort is hosting 120-odd lawmakers now in camp. 
1374,This survivor of riots has a simple message for voters. 
1375,France's group buys brand from Birlas. 
1376,Mamata's dole
1377, theatre
1378, a riot refugee's resolve and more. Also in epaper. 
1379,50k dole in budget for migrant workers hit by 
1380,India's Industrial production contracts 0.4% in Dec 2016 against a decline of 0.9% in Dec 2015. 
1381,Court directs BSF to allow trooper Tej Bahadur's wife to meet him
1382,Passenger opens an chute of aircraft that was  taxiing at Mumbai airport; 1 injured.
1383,Former minister KA Senkottaiyan replaces Madusudanan as Presidium Chairman
1384,Govt appoints directors of ten Indian Institutes of Management. 
1385,State Bank of India Q3 profit more than doubles to Rs 2
1386,610 crore as against Rs 1
1387,115 crore in the same period a year ago. 
1388,In setback for Trump
1389, U.S. judges reject travel ban 
1390,In a bahu makes a demand. 
1391,How shattered Firozabad's industry. 
1392,Mom who lost teen kids in fire same%2c old%2c boring shit as are let off lightly
1393, again. .1
1394,In lawmakers jump ship
1395, a memorial gets a list
1396, a governor ponders. 
1397,All eyes on a governor
1398, note crunch and glass-bangles
1399,  Ansals let off lightly (again)
1400, and more. Also in epaper. .45
1401,gen secy calls on Governor Ch Vidyasagar Rao
1402, stakes claim to form government in Tamil Nadu
1403,VK pays homage at Jaya's memorial; places a sealed cover
1404, presumably MLAs' support list
1405, at the memorial. 
1406,'Good things will happen
1407,' says TN CM after meeting Governor Ch Vidyasagar Rao.
1408,Held detailed discussions with Governor on what is happening in Tamil Nadu
1409, says .9
1410,Cong to boycott PM in Parliament over raincoat remark; will coordinate with other parties
1411, says .10
1412,Opposition disrupts with demand for apology from 
1413,WATCH Top 10 news of the day VIDEO: 
1414,After patience
1415, a test of politics. 
1416,Enough! says Supreme Court and ends 38yr legal battle over project.  
1417,In Tamil Nadu
1418, has the numbers
1419, claims he has the masses. Who decides? 
1420,Match versus gut feeling in Modi's dig at Supreme Court acts on And more. Also in epaper. 
1421,changes stance from accommodative to neutral.
1422,keeps key unchanged-- repo at 6.25%
1423, marginal standing facility and Bank Rate at 6.75%.
1424,Supreme Court asks Justice Karnan to explain why he should not face proceedings. 
1425,Will return to lake next winter? 
1426,With Jatavs as base and pitch for Muslims
1427, BSP's is keeping her rivals edgy.  
1428,On heartland lab. 
1429,CRPF's commandos return to their unit. 
1430,How scientists saved orbiter from death by eclipse. 
1431,KP Nayar on how the engagement between and the Gulf has deepened.   
1432,3 Ds -- (doctor)
1433, dog and drinks -- stood out in PM reply in Parliament. 
1434,Suddenly
1435, a mutiny: It's versus Sasikala. 
1436,The Telegraph published today an article entitled French envoy bets on former colony - Bonjour
1437, new era of amity : h
1438,Bengal's Advocate-General Jayanta Mitra resigns over difference of opinion with state government.
1439,Enforcement Directorate Chief Karnal Singh gets a fixed tenure of to  years.
1440,Why commandos went 
1441,When commandos get homesick
1442, Jewish Nobel for Little stars
1443, and more. Also in epaper. .46
1444,PIL filed in seeking to restrain swearing-in of as chief minister tomorrow. 
1445,Facebook
1446, Google
1447, others launch drive against fake news in France 
1448,Supreme Court orders attachment of Rs 39
1449,000 crore property in Pune.
1450,Supreme Court grants bail to scam accused estranged wife of former Union minister Matang Sinh.
1451,How to shield your child from and  
1452,Javadekar backs restrictive research entry
1453, student stir to intensify- strike today 
1454,Indian hold promise in battle against 
1455,The may be changing its attitude to coalition partners
1456, says Manini Chatterjee. .4
1457,What powers drive to become chief minister. 
1458,Review shows up holes in India's govt-funded 
1459,Now gets license to raid -- without citing grounds. 
1460,Shades of in law change
1461, rises
1462, holes in govt health cover
1463, and more. Also in epaper. .47
1464,New experiences and exciting times ahead in second innings 
1465,Mukul Kesavan on who ought to (and not who will) win in 
1466,Sachin Tendulkar on his 2nd innings
1467, the 3 Ds that lead to greatness
1468, and more. .7
1469,The nachnis of are dying unsung
1470, and so is an art form. 
1471,Irfan Habib on seeing the past with both eyes on the present
1472, and mixing folklore with history.   
1473,Sonia Sarkar on the jig-gigs that were a key tool in run up to 
1474,Why Calcutta's are learning... Chinese.  
1475,All that voters in these villages want is a permanent With India. 
1476,In 7 Days: What Calcutta's are learning
1477, nachnis of fighting for rights in and more. 
1478,A village cries for a bridge
1479, Mukul Kesavan on 3 Ds
1480, and more. Also in epaper. .48
1481,Judge blocks Trump's ban --effective nationwide 
1482,Promised  denied helicopter
1483, soldier trekked through snow to take his mother's body home. 
1484,Australia
1485, US clash over immigration; puts India on hold. 
1486,A soldier's painful journey
1487, bonds for political funding
1488, Trump on immigration
1489, and more. Also in epaper. .49
1490,follow us to DM/ mail to ttwebonlinefeed release to any of 3 aggregators on our site under press releases
1491,Rich get skewered
1492, honesty hug for bottom rung -- while mystery persists over missing taxpayers. 
1493,Relief on front for small firms hit by 
1494,Ahead of elections
1495, finds nothing in to sell to voters. 
1496,So you thought the has made transparent? 
1497,There was more history around the than in it
1498, says .11
1499,DeMitronisation in relief for small firms
1500, no honesty hug for well-heeled
1501, and more. Also in the epaper. 
1502,Double digit has been controlled; sluggish growth replaced by high growth; war on launched: 
1503,We have moved from discretionary based administration to policy based administration: 
1504,Watch the Live Stream of FM Shri Budget Speech 2017-18 on the link below 
1505,PM reaches Parliament
1506, cabinet meeting begins. 
1507,FM departing from North Block to and Parliament House
1508, to present 
1509,Indian govt draws goat parallel in case. 
1510,BREAKING: to go ahead as scheduled
1511, say sources.1
1512,not clear right now. Speaker to decide....
1513,How Calcutta's menace was born -- and is eating up all pavements and footpaths. 
1514,Why grabbing footpaths is good business for everyone (except pedestrians).  
1515,Will strike at decodes draft order.  
1516,For the 1st time
1517, Union will include railway budget. Today
1518, at 11am. 
1519,Confusion after replies to CEO. 
1520,Due to sudden drop in visibility at BLR
1521, our to  fro flights are affected. As a result consequential delays are expected.
1522,WATCH Union Budget 2017 LIVE on ABP News 11:00 AM onwards 
1523,Trump picks 49yr-old judge for lifetime job at Supreme Court of US. 
1524,In BJP could face backlash. 
1525,Govt admits economy will take a hit because of 
1526,US gives a scare
1527, how to  law officers did their job
1528, confessions
1529, and more. Also in epaper. .50
1530,US gives a scare.1
1531, how to  law officers did their job.1
1532, confessions.1
1533, and more. Also in epaper. .51
1534,Full expected in a month or two: Arvind Subramanian.
1535,Headline inflation as measured by Consumer Price Index (CPI) remained under control for the third successive financial year:
1536,Agriculture sector to grow at 4.1 per cent in the current year up from 1.2 per cent in 2015-16: 
1537,Growth rate of the industrial sector estimated to moderate to 5.2% in 2016-17 from 7.4% in 2015-16: 
1538,India's growth rate at constant market prices for 2016-17 seen at 7.1% 
1539,Finance Minister Arun Jaitley tables in Lok Sabha
1540,LIVE Pranab Mukherjee to address Parliament at 11am 
1541,Country's first conviction: Minister sentenced to 7 years rigorous imprisonment. 
1542,Economic Survey is to be tabled in the Parliament shortly. Know your Economic Survey: 
1543,Sibal and Datar spike BCCI wish 
1544,President Trump fires top government lawyer Sally Yates for defiance on immigration order 
1545,FM to table today in 
1546,Trump's order has parallel in citizenship bill. 
1547,Prabhat Patnaik on why has been a monumental 
1548,Why farmers are dumping crop. 
1549,Supreme Court ropes in former top auditor to run 
1550,Why no one suggested names of and for ICC meeting. 
1551,Pakistan under pressure from ban
1552, auditors at helm
1553, Madam and more. Also in epaper. 
1554,Limits on Cash withdrawals from Bank accounts and ATMs - Restoration of status quo ante
1555,After outcry
1556, U.S. loosens curb on re-entry by green card holders 
1557,Five soldiers from Machhil attain martyrdom; Detailed statement attached 
1558,dept crackdown on hoarders; issues 87 notices
1559, attaches 42 assets worth crores under the new 
1560,Payments Bank to offer 4.5% on deposits up to Rs25000
1561, 5% on Rs 25000-50000
1562, 5.5% on Rs 50000-100000.
1563,Supreme Court shoots down govt bid to put sports ministry bureaucrat in panel to run 
1564,Historian Ram Guha
1565, IDFC official Vikram Limaye
1566, former captain Diana Edulji are others in panel to run 
1567,Supreme Court names former CAG as head of 4-member panel of administrators to run 1/3
1568,Court summons CM suspended BJP MP as accused in criminal defamation plea by  
1569,Amulya Patnaik has been appointed new Delhi police commissioner. Patnaik is a 1985 AGMUT cadre IPS officer.
1570,Fire Weather Watch issued May 17 at 4:21PM CDT expiring May 19 at 9:00PM CDT by NWS Lubbock... {link}
1571,Weekend Weather Causes Delays In I-270 Bridge Work  {link}
1572,US GAS: Warm-Weather Forecasts Lift Natural Gas Futures {link}
1573,#WEATHER:  2:53 pm : 57.0F. Feels 56F. 30.10% Humidity. 6.9MPH Northwest Wind.
1574,...SHOWERS AND THUNDERSTORMS MOVING SLOWLY OVER THE AREA... AN AREA OF RAIN WITH EMBEDDED THUNDERSTORMS WILL DRIFT SLOW {link}
1575,Record LOW humidity in Phoenix today:  {link}
1576,"@mention no, normal pajamas. it's not that cold out!"
1577,@mention Is any part of this storm system going to make it across the mountains/in to NC & SC?
1578,WZTV FOX17 :: Weather {link}
1579,"@mention yeah, i'm talking, you see these pics of the river up on the rocks, as opposed to storm conditions"
1580,Just arrived at Garrett- 55 degrees- going to be a cool night.
1581,RT @mention: Strongest storm now crossing Natcher Parkway south of Masonville & moving into northern Ohio County. #tristatewx
1582,"I'm gonna take a bath and read. I planned to make pasta puttanesca for dinner, but the weather is making me want Chipotle Chicken Chowder."
1583,"Thunderstorm Light Drizzle in Vicinity and 68 F at Jacksonville Municipal Airport, IL Winds are from the South at 13.8  {link}"
1584,Severe Thunderstorm Warning issued May 19 at 3:40PM MDT expiring May 19 at 4:30PM MDT by NWS Boulder {link}.... {link}
1585,"Tornado season really is nvr over. If its a severe thunderstorm, a tornado can form RT @mention How long is (cont) {link}"
1586,"RT @mention: Severe Thunderstorm Warning for Dakota, Goodhue, Rice and Steele County in MN until 2:30pm. More: {link} & o ..."
1587,#WEATHER:  3:53 am : 57.0F. Feels 55F. 29.98% Humidity. 10.4MPH North Wind.
1588,"Clouds & Showers East, Sunny & Dry Elsewhere {link}"
1589,LIVE COVERAGE: Weather delays Amgen start until 1:15 pm {link}
1590,"Thunderstorms today, high 69 (21 C)."
1591,"RT @mention: WINTER STORM WARNINGS for CO and MT for SNOW 6 - 12 inches
{link}
#weather #news #snomg #blizzard #wx"
