,0
555,Swapan Dasgupta on how elections have dashed hopes that would weaken. 
556,People wanted to buy in bulk from govt
557, take it home to...well
558, Nitish is not stupid.  
559,In UP ministry
560, keeps 36 portfolios for himself. 
561,In Bihar meet
562, to  ask questions-- and get to spend 6 hours with cops (but no answers). 
563,40
564,000 join the 4500  already on in after assaults. 
565,Despair at after research seats are slashed. 
566,7 in car crushed under tanker carrying molten tar. 
567,How govt slipped in secrecy clause over by companies. 
568,Attack on Westminster
569, cash cloak for parties
570, molten tar wipes out family
571, and more. Also in epaper. .18
572,LIVE: British police say there are casualties
573, including police in attack near UK parliament; cannot confirm number. 
574,The today doubles Annual contracts of India cricketers to Rs to  crore
575, Rs 1 crore and Rs 50 lakh respectiv
576,TN farmers in skull protest in Delhi 
577,UP CM bans paan
578, chewing in govt offices
579, hospitals
580, schools
581, colleges --for a healthy 
582,Ugly high-rises are taking over while grand structures are being ignored
583, bungalows razed. 
584,Committee constituted by the Ministry has recommended that city taxis should be allowed to run on App Based platforms. 
585,Chief Minister bans paan masala
586, gutka
587, polythene in all government offices in 
588,Has just ordered a ban on all  
589,Who drafted challenge to high court order in case
590, bureaucrats wonder. 
591,With 84% cut in research seats
592, most elite centres (including will have no intake. 
593,Crude 'architecture' is taking over the world's only city with for buildings by 
594,Crude buildings are taking over the only city in the world with for iconic buildings by 
595,Anti-Romeo squad starts in Lucknow VIDEO: 
596,Effigies burn on JNU strike after 84% research seat cut and affirmative action junked 
597,KP Nayar on why
598, for the way to Europe lies through 
599,After steps in
600, Bihar to tell why govt rejected an idea. 
601,How slashed research seats
602, why is key to Europe
603, revisited
604, and more. Also in epaper. .19
605,SC issues notices to Centre
606, Election Commission on plea seeking scrapping of and other benefits given to 
607,I'm one year younger to  one year elder to in 
608,Govt proposes limit of Rs to  lakh on down from Rs 3 lakh as proposed in 
609,Supreme Court says final hearing of disputes case from July 11.
610,Supreme Court says it will auction Aamby Valley project if money is not paid by and others.
611,Supreme Court takes on record 'unqualified apology' tendered by Bengal counsel
612, dismisses plea as withdrawn. 
613,Supreme Court terms as 'unfortunate' the grounds cited by Bengal govt in its plea against HC order asking CBI to take over case
614,Supreme Court refuses to stay CBI probe into sting in which several leaders were allegedly caught on camera taking money.
615,to visit today for the 1st time after taking oath as UP CM 
616,inhe sikhaiye!!! MSY requests to teach ropes of politics..
617,Patna zoo to sell nesting boxes for 
618,Patna's tires out machine. 
619,Protein from an Australian venom may help victims recover faster. 
620,Why choice of as CM is giving UP the jitters. 
621,BJP rushes to shake off upper-caste tag. 
622,In village
623, headmaster finds truant kids harvesting crop. 
624,So.2
625, has agreed to teach the ropes? 
626,A tutor for kids roped in for harvest
627, a telecom giant is born
628, and more. Also in epaper. .20
629,Britain to trigger Brexit on March 29: 
630,Govt to merge Bharatiya Mahila Bank with for greater services outreach to 
631,High Court grants stay on criminal proceedings against minister in case filed by MLA Mohua Moitra.
632,the agitation is delayed by 15 days. The trouble will soon come.. 
633,BSP leader shot dead late last night
634, murderers at large
635,4000 migrated in 2015 to shield their capital. 
636,After 65 years
637, Bengal unit of finally gets a full-time chief. 
638,No
639, minister
640, there is no project from India to test on the 
641,Haryana's have called off march to and siege of  Parliament. 
642,Yogi vows to work for all. 
643,After the BJP is certain it can get away with anything
644, says Manini Chatterjee. .1
645,After mass bunking
646, orders a weekly for all trainees. 
647,Fans of see him as a future PM. 
648,Yogi as PM
649, Sunday holiday for recruits
650, on the Moon. And more. Also in epaper. 
651,Give a trial run for to  months
652, says .1
653,tells to give 2-month trial run. Also disagrees is a vote for 
654,Centre mobilises 247 companies (about 24
655,700 personnel) of paramilitary forces in Haryana
656, Delhi  Uttar Pradesh in view of 
657,government okays 33% reservation for women in state jobs 
658,Yogendra Yadav on the future of India under why get it wrong
659, and more. .3
660,What does it take to be a in the eyes of the 
661,Parties led by can't seem to look beyond family for top posts.  
662,In 7 Days: The BJP's 'good dynastic parties
663, Bengalis get their local again
664, and more. .4
665,set to take oath as UP CM today
666,  to be sworn in as Deputy CMs 
667,BJP sees stamp missing in choice. 
668,How BJP sold development -- and then sprang a hawk. 
669,Former captain Michael John Clarke on strengths of a team
670, leadership and more. 
671,In a BJP govt with faces. 
672,The graveyard echo in choice as chief minister. 
673,BJP stuns with UGC letter a forgery
674, doctors split over Bengal Bill. And more
675, also in epaper. 
676,Yogi to be sworn in as chief minister on Sunday afternoon. 
677,Yogi Adityanath arrives at the venue of meeting of MLAs amid talk that he will be named chief minister
678,'Shocked' by HC order on handover to CBI
679, vows to move Supreme Court. 
680,to retain TV innings. 
681,Whatever India offers the biggest issue is 
682,Calcutta HC sends case to CBI. 
683,How went to meet 
684,How Rahul met HC gives to CBI
685, dig at Amartya
686, and more. Also in epaper. .21
687,HRD to stop funding research on  social exclusion
688, report  
689,The oath taking of new UP CM  to take place at 5 pm on Sunday: Keshav Prasad Maurya 
690,HC directs to conclude preliminary inquiry within 72 hours and register FIR
691, if required.
692,Calcutta High Court orders to probe sting operation.
693,No serious concerns regarding India captain 's shoulder injury
694, says .2
695,Cloud over state boss Keshav Maurya's chances of becoming chief minister. 
696,most likely to be elected as UP CM: Sources 
697,India urges to talk to 
698,What zoo is doing to mark 
699,100
700,000 in villages are taught to Google designs
701, recipes  skills. 
702,HC scraps plea against JNU norms. Seat cuts
703, 100 per cent viva to follow 
704,After surprise resignation by boss Manohar
705, back to square one. 
706,What happened to promised funds for 
707,Sudden blaze destroys bungalow. 
708,No Some Bengal traffic cops do the with pen and  paper. 
709,Leaving out has weakened travel ban order for Muslims
710, KP Nayar says. 
711,Funds fear on research
712, too hot
713, death on 1st solo trip and more. Also in epaper. 
714,Newly elected MLAs to meet in Lucknow on Mar 18. 
715,New Delhi: Health Minister briefs Media on LIVE: 
716,protected against tampering/manipulation: Election Commission 
717,Elaborate system in place to prevent misuse of EVMs: Election Commission 
718,NIA takes over investigations into Bhopal-Ujjain  train IED blast case
719, takes custody of 3 accused from Bhopal police 
720,No merit in claims that can be tampered with; such allegations are wild and baseless: 
721,Navjot Singh Sidhu sworn in as a cabinet minister of govt
722, greeted by CM Captain Amarinder Singh 
723,Capt Amarinder Singh takes oath as 26th Chief Minister of Watch LIVE:  
724,British DHC Bruce Bucknell with Institute of Entrepreneurs Head Manoj Das discussing skill devt in NE at 
725,Akhilesh to meet newly elected SP MLAs today
726, to decide on new legislative party leader  future course of action. Will also
727,With 22 in support
728, CM to prove majority in assembly today.
729,Why will be a smooth affair for today 
730,When a man took his neighbour to court over pet dogs that bark at night-- and judge is a 
731,Regimes changes. Bullying of police officers does not. 
732,How returned to a warm welcome in 
733,Boss of India's largest cautions against waiving 
734,Laws cannot replace the trust and compassion between and 
735,Amit Chaudhuri on and why it is hard to give up the experience of pleasurable pain. 
736,Subir Bhaumik on how has cast a shadow over India's ties with 
737,Shashank Manohar quits And how! 
738,How boss quit
739, caution on loan waivers
740, arson on film sets
741, and more. Also in epaper. .22
742,Govt seems to have slipped in an in Budget2017. 
743,Govt seems to have slipped in an in Budget2017. .1
744,Rohith's buddy's autopsy caught in distrust 
745,Rape-accused leader Gayatri Prajapati nabbed --after roaming in Delhi
746, Gurgaon and Bengal. 
747,Municipal in to be held on April 22: State Election Commission
748,Manohar sworn in as chief minister of 
749,CM demands conducting MCD polls via ballot paper in place of EVMs 
750,SC refuses to stop from becoming CM
751, but calls floor test. 
752,Finance minister has been given additional charge of ministry of Rashtrapati Bhavan
753,Shri Arun Jaitley shall be assigned the charge of the Ministry of Defence
754, in addition to his existing portfolios
755,has accepted the resignation of Shri Manohar Parrikar from the Council of Ministers with immediate
756,FinMin Arun Jaitley given additional charge of Defence Ministry following Manohar Parikkar's resignation: Rashtrapati Bhav
757,No limits on cash withdrawals from today 
758,Parrikar resigns as defence minister
759, to be sworn in as chief minister tomorrow. 
760,The Hindu undercurrent that led to surge. My story from Feb.  
761,Raj Bhavan denies reports of calling any party to form the government.
762,Governor asks Congress CM Okram Ibobi Singh to resign so that process of formation of next govt can be started.
763,walks; leaders bow before the 'Nayak'. My story  
764,In this mandate
765, I see a new Highlights of PM speech at BJP HQ 
766,Oil prices hit three-month low as U.S. rig count climbs 
767,Assam lawmaker wants national body to save the 
768,200000 people turned up at in Bolpur for its famed 
769,Hardest interview of my life
770, says of her bid to enter 
771,Here's BSP theory on why with 71% population voted BJP. 
772,People don't want handouts
773, they want says at victory rally. 
774,Modi says people don't want handouts
775, Malala's Oxford entry
776, reverse polarisation and more. In special epaper link. 
777,No print edition today
778, but the same look at epaper at special link. 
779,Match referee and umpires went by the book
780, says .3
781,After BJP claims voters have risen above 
782,How has strengthened a sense of belonging among Calcutta's 
783,Hiring people for a task in which they have an edge. 
784,The consolidation of independent 2nd countrywide political entity. 
785,In 7Days today: BJP's expanding footprint
786, taking up gatka
787, Brit-bashing
788, hiring blind employees. And more. 
789,U.S. Attorney Preet Bharara is fired after refusing to quit. More here: 
790,Yogi Adityanath or Keshav Prasad Maurya
791, know the names of who can possibly be next UP CM VIDEO: 
792,Time for Modi's reforms. 
793,Piyush Srivastava looks at the stunning victory in 
794,Should be a black mark on report card?  
795,How became demonetised notes in 
796,Why victory may be bad news for 
797,Mukul Kesavan on BCCI and the curious case of versus Steve Smith. 
798,How magic combined with organisational strength brought back 1-party system. 
799,How Modi won UP
800, dynasties demonetised
801, what the numbers say
802, and more. Also in epaper. .23
803,After 15 years
804, BJP captures in record show. 
805,Congress wins 77 seats in 117-member assembly
806, 1 short of two-thirds majority.
807,BJP (13 seats) fails to get majority in Congress emerges single largest party bagging 17 seats in 40-member House.
808,I congratulate Shri. Narendra Modi and the BJP on their victory in Uttar Pradesh  Uttarakhand
809,l Congratulate people of UP
810, we respect and accept the verdict: AIMIM chief 
811,l reaches Raj Bhavan in to tender resignation as UP CM 
812, I CM Laxmikant Parsekar tenders resignation. He lost to seeandidate Dayanand Sopte from see
813, I want to quit fighting any type of election: Irom Sharmila after losing her maiden election in (ANI)
814,| I can understand the state ohf mind ohf ji right nohw. Hence
815,I dohn't want toh cohmment ohn it: Amit Shah oh
816,| chief press conference to begin shortly. Stay tuned.  
817,gets majority in 117-member wins 59 seats
818, leading in 18 other seats.
819,As BJP heads for landslide win in Samajwadis concede defeat but Mayawati wants fresh polls using paper votes. 
820,UPDATE: Manhattan attorney Preet Bharara was asked to resign along with other Obama-era U.S. attorneys - DOJ. 
821,What Jharkhand body has been doing to upgrade pitch for test. 
822,Manipur Assembly Election Result Live: Congress ahead in 6 seats 
823,We will accept the people's mandate
824, says SP leader Shivpal Yadav 
825, l  Uttar Pradesh (leads/trends) 373/403 264 70 27 Others 12 
826,What Jharkhand body has been doing to upgrade pitch for test. .1
827,How has become epicentre of industry in Bihar. 
828,In upright cop has his son arrested. 
829,Forecast for wet Dol (Sunday) and dry (Monday). 
830,Army chief's words ring in pellet-hit boy's ears. 
831,(leads/trends) 05/70 BJP: 3 CONG: to  Others: 0 
832,(leads/trends) 26/117: BJP/SAD: 3
833, CONG: 17
834, AAP: 6
835, Others: 0
836,Uttar Pradesh (leads/trends) 103/for03 55 26 18 Others for 
837,Foreign policy must be rooted in ethics
838, Sunanda Datta-Ray says  as lines up visit to  
839,Get all the latest  fastest updates on throughout the day here: 
840,Facing arrest warrant
841, high court judge again plays card. 
842,117 acquitted
843, 13 held guilty in murder.  
844,These will be ready long before winners are named. 
845,13 guilty in murder
846, laddoos  winners
847, 1st warrant for judge
848, and more. Also in epaper. .24
849,India's production grew by 2.7% in January. 
850,Govt says Reliance and have tendered apologies for using Prime Minister's picture in their ads without permission.
851,Supreme Court issues arrest warrant to get high court judge to face case. 
852,How broke ranks with other bodies in east
853, again. 
854,Winners of awards at The Telegraph's - Advantage 2017. 
855,Amit Roy on tour in 
856,Bengal tops again --in of women and children. 
857,India's action against charity trigger spat with administration. 
858,In Assam
859, militants opt for poaching to fund outfit. 
860,South Korea's Constitutional Court upholds President Park's impeachment 
861,After plan to cap fees
862, private put expansion on hold. 
863,3 publishers close suit against photocopying of 
864,Akhilesh keeps options open on 
865,Akhilesh and his 'aunt'
866, publishers lose to photocopiers
867, Bengal bill scares pervert schools
868, and more. Also in epaper. .25
869,From old a street directory
870, and shopping directory
871, rolled into one. 
872,What got when it bred local pig with variety. 
873,FLASH - Ghouse Mohammad Khan
874, mastermind of module of arrested by police in  
875,puts forth searching questions to liquor baron on the disclosure of his assets to the court.
876,Supreme Court rejects age plea to skip jail. 
877,NIA to take over encounter
878, MP cases: Rajnath. 
879,Fresh FIR filed by JNU alleging misbehaviour by students. Students  accused of assault
880, earlier
881, have been summoned by
882,Jammu and Kashmir: 2-3 terrorists holed up in house
883, firing underway
884,Re-polling underway in 8 assembly constituencies which went to polls in 1st phase on March for 
885,What Meghalaya got when it bred local pig with variety. 
886,In racketeers backed by politicians prevent legal by govt licensees. 
887,Rural planned in to counter azadi call.  
888,India to tap for 
889,Supreme Court caution on not for stealing saris
890, please! 
891,IS terrorist in Lucknow: to make statement in on UP
892, MP incidents 
893,Amit Roy on how Maneck Dalal launched International. 
894,Indian medical body moots for handling after successful trials in Tamil Nadu. 
895,Record haul of booze
896, drugs during despite 
897,Suspect in attack nabbed in 
898,Did police jump the gun in claiming hand in train blast? 
899,2nd phase begins; CM Okram Ibobi casts his vote
900,ABP NEWS EXCLUSIVE: Arms
901, ammunition and explosive material recovered after Lucknow operation ends VIDEO:
902,Some Indian politicians still need this lucky charm -- a campaign bus. 
903,It was a captain's knock
904, off the turf too
905, says .4
906,EDITORIAL: Why mayor cannot be trusted with the 
907,India could gain from a partnership with in the says KP Nayar. 
908,Polling underway in 40 Assembly seats spread across 7 districts in seventh and final phase of 
909,Anti-terror operation in Lucknow's outskirts ends
910, 1 terrorist killed; reports of to  terrorists holed up false: ADG 
911,Indian wants police cover
912, citing outsider inflow  open campus. 
913,Rahul says afraid
914, wants CISF presence
915, life term for Prof Saibaba. And more. In epaper. 
916,No one to be deprived of benefits for lack of benefits to continue with alternate means of identification: 
917,It was a new mother who challenged change in date for exchanging notes. 
918,After Sept18 terror attack
919, army blocks key highway. And civilians are suffering. 
920,1 rupee increase in mocks dignified-living plea
921, says .5
922,As is destroyed
923, govt sparks traffic chaos with plans for grand gate in 
924,Ruchir Joshi on how Calcutta's is being destroyed as vandals decide the future. 
925,Bengal law that singles out may keep out investors -- and critical cases. 
926,Jitters for pervert healthcare in Bengal
927, city of no palaces
928, a Dhoni fan's tenacity
929, and more. Also in epaper. .26
930,What meant by 'potato factory' is thriving reality for Bengal farmers in chain. 
931,Court asks for report on fracas
932, but puts question mark on video. 
933,Former president renders unqualified and unconditional apology in the Supreme Court.
934,Supreme Court wants to know if exchange of notes has been stopped before March 31 deadline. 
935,case: exempts Centre from filing status report before it on proceedings before the international tribunal.
936,Supreme Court is told that people not being allowed to deposit notes till Mar31 as promised
937, asks govt
938, to explain.
939,How notes are entering system via Calcutta business district. 
940,This team has come up with a that has minimal side-effects. 
941,The process of social change is seldom linear or pretty
942, says Manini Chatterjee. .2
943,In unofficial ban on dubbed movies is challenged by  
944,No food for dissent in this tradition of 
945,After violence
946, space for debate and dissent continues to shrink. 
947,Another 'go-back' shooting in US
948, academic siege
949, a menu for judges
950, and more. Also in epaper. .27
951,Policeman
952, two militants killed in encounter in that lasted nearly 12 hours.
953,If it's spring
954, it must be a varsity 
955,My story on a 100-yr-old treasure from streetsmart Bengal (
956,I married a Maoist by Swati Sengupta 
957,If you don't actually live then honesty and integrity won't be embraced
958, tells 
959,Why you could meet a saltwater next time you are in the 
960,An old street directory of had astounding detailing. 
961,The rallying cry of has become a thing to behold and celebrate this season. 
962,How Prime Minister made himself the man to beat in 
963,In 7Days: on rallying cry of students
964, from Varanasi
965, crocs in and more. 
966,Mukul Kesavan on what the attack on means. 
967,Flames of singe events at other colleges. 
968,While Rahul and Modi trade barbs in UP
969, some farmers in get lucky with 
970,leftist who became minority voice 
971,Private fear plan to monitor functioning will give local leaders a death grip. 
972,Why govt decided to merge industries departments. 
973,How Centre hiked for jobs scheme by... a (and what you can do with a rupee). 
974,Trump administration resists economics of and visas for Indian companies. 
975,US visa worries
976, Bengal private schools in a fix
977, focus on MSME
978, a wage hike
979, and more. Also in epaper. .28
980,Punjab
981, JK to resume work on on system river. 
982,69% polling till 1pm in 
983,3 gardens make a mark at US meet.  
984,Govt's latest: no then no for school kids. 
985,After 23 years
986, increase ordered in  for workers. 
987,Caution on site inroads for mayor (who is also minister of housing and environment.) 
988,Fear of law's provisions may force in private to shun critical cases. 
989,A  perspective on strife. 
990,Why Karnataka body decided to boycott awards function. 
991,After break with Russia
992, opens entertainment TV market to 
993,Top bureaucrat is innocent
994, being framed by politicians
995, IAS officers insist. 
996,After law to check private hospitals
997, takes aol instant messanger at 
998,Supreme Court gives govt a chance to oppose judge appointment on 'national security'. 
999,China cautions over visit to Arunachal Pradesh. 
1000,Tension over visit
1001, pill for schools
1002, SC collegium accepts govt thorn
1003, and more. Also in epaper. .29
1004,What happened when security agencies argued over need for tagging 
1005,Fears over plan to set rates for 
1006,Blasts at office in 
1007, to  injured 
1008,After fracas over overbilling
1009, Bengal drafts Bill to check bills. 
1010,There should be no room for in India for  Indian
1011, says President Mukherjee. 
1012,Notes for Indian
1013, muddle
1014, controlling and more. Also in epaper. 
1015,4/The pilot project for Green Transportation across National Capital Region is the next such service being introduced on
1016,Rare species says hello after a century. 
1017,Top to make you pay for cash transactions at branches. 
1018,How Bengal detectives had to get religious to nab leader accused of 
1019,Having pulled up for negligence  Bengal CM orders party not to meddle. 
1020,If development means filling up it also means death of 
1021,Rock fossils in have clue to on Earth. 
1022,India would do well to abolish the says 
1023,Junior home minister admits he made comments on without having seen her video. 
1024,How govt made look benign: use revised (and lower) base for comparison. 
1025,Hole's in armour
1026, a key minister who comments freely
1027, Modi's bug
1028, and more. Also in epaper 
1029,Jaitley says likely to pick up further in coming quarters. 
1030,FM Jaitley says Q3 data substantially impacted by economy's resilience  remonetisation helped.
1031,A blaze puts the spotlight on grand pieces of history that lurk in lanes. 
1032,Kanwal Sibal on why could be a victim of disruptive thinking. 
1033,The effect: a batsman gets booed for scoring a century. 
1034,Gunbattle that felled father. 
1035,Defensive cries media trial. 
1036,Delhi worried over silence of on  
1037,In midst of an incendiary wish from 
1038,What teachers at said about her stand. 
1039,Mystery over effect in data. 
1040,Mystery over data
1041, teachers back worry over silence
1042, and more. Also in epaper. .30
1043,GDP grew at 7% in quarter
1044, full year projected at 7.1%. 
1045,BREAKING: Government forecasts 2016/17 growth at 7.1 percent 
1046,BREAKING: Indias December quarter GDP at 7 percent (Reuters forecast was 6.4 percent) 
1047,Growth of 8 core sector slows to 3.4 pc in January compared to 5.7 pc in the year-ago month.
1048,Ashok V Desai on formula for tackling of banks. 
1049,CRPF getting to take on planted by 
1050,A 'nationalist' cub threatens to cut off finger of 
1051,On courage
1052, and cowardice; season of buds and thorns
1053, and more. Also in epaper. .31
1054,57.36% turnout in fifth phase of voting ends by  large peacefully in 51 assembly seats: UP CEO T Venkatesh
1055,arrests woman director of a Hong Kong-based firm in a Rs 1478 crore case registered post 
1056,ABVP takes out Tricolour march with 180ft long flag from Ramjas
1057, principal Rajendra Prasad says his heart bleeds over v
1058,begins in 51 Assembly constituencies spread across 11 districts. All eyes on 
1059,JP Yadav on rebranding of 
1060,Backlash after hails as a 'true patriot'. 
1061,KP Nayar on what Governors of US states had to say about 
1062,Message from Governors of US states
1063, Modi criticised
1064, why STEM is important
1065, and more. Also in epaper. .32
1066,The 'control' part in has to go
1067, says .6
1068,How offered to help of 
1069,How the formidable Madame of Calcutta's runs her business. 
1070,Pushing 86
1071, physicist still has his table full
1072, says Prasun Chaudhuri. 
1073,Resistance to in Trumpland is nothing citizenry can yet match. 
1074,How is pushing his team to use twitter as a tool. 
1075,In 7Days: Modi's rule by twitter
1076, Big Boss of Calcutta's and science of giving
1077, and more. .5
1078,Bihar CM cites siltation threat of barrages on National Waterway. 
1079,It was the day of left-arm turners
1080, and took aol instant messanger at money in and more. 
1081,How is playing in DU colleges. 
1082,A question for America
1083, Big Brother at academia
1084, day
1085, and more. Also in epaper. .33
